{
  "schema": "mormot2-monitor/findings@1",
  "edition": "2026-09-02",
  "reviewed_shas": [
    "aef05e96dcd947c2dd0a82818c47a449f2ba99bd",
    "76f15a8639aef77cfba3bc28da4b7f2d53659b6c",
    "6f064610e7c4922a6034bb4ab929ba535f944038",
    "804bc9700313eaf13b4ad09b594e699ab7a790b1",
    "0a0f36a4ea6d7e73ac1a5d9b51e02231fb954786",
    "428ee2219b51700f11f86d88909fa580c28c78fe",
    "a5e68484e7f8341aee3f7d4f9e42a8ca3155ab9e",
    "907c92f53802625839946fae515a7a90661c2b11",
    "844e8029aa4750850d65e632909632c4d3f0031c",
    "75bf766051bb3701c90b3b2baad2a815c3d2e928",
    "4be92b7a4ef633830bbd3337d8ab1179d56a4483",
    "ccde07c6ce4d26df2bfef5569c01a34dd9482620",
    "83c4df20f15661a856c66bcdba97f3ec2b4fd41a",
    "fbb6f6dc219fa69dcdc9a2d03cf9f2c9e2b791ea",
    "17f74f8129f07e27df4e9b952acc0ec8e2915503",
    "55fa224e49a2b4285b809bb5d44dea062c2b23ed",
    "6c82cf9377f726ee7feb186fb53c3968a4c7bc93",
    "62bd0e82ae429d33a7c779063d8b77fc01b7b97f",
    "719cd877956cc308dd387ce3abafb55e4790bb1e",
    "4e7838758f122a59192d6eff0d4a1e8274255a9c"
  ],
  "findings": [],
  "unverified": []
}
