{
  "schema": "mormot2-monitor/findings@1",
  "edition": "2026-09-04",
  "reviewed_shas": [
    "14d901e85a21de249edb3299acfec5d2135ce608",
    "bcf834a59d300be08e73d71812780021d1f758a2",
    "ad1dcbf50c0cdfa2585484e1cbfba1742cd2058b",
    "a6d76aa95a3b9114492a1e84fbf7c67bb41b4313",
    "83f4846bc3d3d8c3d8821e0651b17b8d07d3151e",
    "14d5a05d6cdec6bc70c204c0f199e490f883eb30",
    "c7887dc9f10df27e98cb474d8d614ea0829961cc",
    "d7b698d806484cdfda2bb568045228e3ee331320",
    "7df2308e01cdc0b7a07fe3fee8fd50454bf96f30",
    "6f53f3d7b19d4d1dcb0188dd18e6edde6625efcb",
    "84ab94497e190d52e942fa51e84f91269cf4f45f",
    "f7cfb5db3b6a90aea32750c6bff4ce63d9a9d1be",
    "b4238a29efc6e4586dc21d92cba5b72e4b5f07dc",
    "2f0cdace275a3e05560fea3237458c0326265197",
    "6dda432f621e8cc4a4f4e16bbededf0d857a7ce7",
    "56660c17306df80d5a420b1081bd12f32dcfe9e8",
    "afde3637c01d04b2cb7cc415a5d6198de03e4ac6",
    "69869f49271bec0d6d943c2045ba9f197ea58b7a",
    "f115b536b06f98eb8f8fc2148c519749628bbe23",
    "9a1c1313f8b656504033a548f96b8ab2cad57d7c",
    "8ef4ae1bfe81f643cdeb7f9d22040bbc2cbef988",
    "f1f8d76658dbc5b5d5dae9689364024657eeaf5f",
    "332614f57f8ec0e958bf390899f313cd7a89d266",
    "86422854df36929c606400f85bae7cc3aa6b23f2",
    "5678b9d9aa17ff454f7949fe2f8d4d4bd1b20e7c",
    "41dbfbbae68d870ef07cce426785254b9a149abd",
    "35d353c919d76f8d4f944001190d131cf6dafa55",
    "2c03b28af5cc7536011eac3a2dcbc29f6812c12a",
    "8d60e5edd9c876f44f2f4c3c0247eb5a2de5be62",
    "57660dac29601caf0c6e8f0082ec839a52137ff2",
    "677a35798f971fcda3c095391fd93d36b07011d6",
    "7627b1ad104e5408fb93e63296191c00579aae5c",
    "a0141ee6f988c4099174af2460b4e9203daef868"
  ],
  "findings": [],
  "unverified": []
}
