{
  "schema": "mormot2-monitor/findings@1",
  "edition": "2026-09-05",
  "reviewed_shas": [
    "68f8a3cbbe015b40d6ae0ef16282598f9b9501b0",
    "93da31e1dcd04bc35ff3d401493ffe1fde14e33f",
    "6539d93d7073d96b2cc84be01cb1a643fe198841",
    "9cb2c9bc5e40d1af419a5f938fa380cd206052b5",
    "aa0c82133fdae344c21342b964685d5cbc077767",
    "a697074f5914a0d2cf5f7e07e0e22adbc7729532",
    "f50a5e53d2727b672739da5960a22d942813ca88",
    "a7195425aaa99f7c57f6e3220eb5002a353743ca",
    "487c21e6741bec40f7b7ab24bd270e80bcd1b93f",
    "76d9d035a269702786dd1b8959a577cd85101cae",
    "cf21f26e9fce6549b424b0c56f32ade40c1c1f8c",
    "fe0b21d2a95e4a8ba3b646775125b90853ebb370"
  ],
  "findings": [],
  "unverified": []
}
