{
  "schema": "mormot2-monitor/findings@1",
  "edition": "recall-off",
  "reviewed_shas": [
    "b61d9db4d8259726efc7b307fd765e705f32ed53",
    "7dd5c8c6d9bdd93d9ea4c8fced099eb7524f0ad2",
    "00693ed14131e602ce8699ecb245c17a2f82d36b",
    "5463ae5712f7140f3f41d9271847c00ee8ba1449"
  ],
  "findings": [],
  "unverified": []
}
